{
  "generated_at": "2024-01-01T01:00:00Z",
  "alerts": [
    {
      "start_index": 22,
      "end_index": 26,
      "confidence": 0.82,
      "reason": "Sustained flow drop vs EWMA baseline"
    },
    {
      "start_index": 28,
      "end_index": 33,
      "confidence": 0.9,
      "reason": "Rapid pressure decay with temperature rise"
    }
  ],
  "labels": [
    {
      "kind": "missing",
      "start_index": 5,
      "end_index": 6,
      "reason": "Missing telemetry value(s)"
    },
    {
      "kind": "flatline",
      "start_index": 10,
      "end_index": 16,
      "reason": "Flatline detected in flow signal"
    },
    {
      "kind": "spike",
      "start_index": 18,
      "end_index": 20,
      "reason": "Short spike during valve adjustment"
    }
  ],
  "summary": {
    "alert_count": 2,
    "label_count": 3
  }
}
